{
  "$schema": "../../packages/core/schemas/task-graph.schema.json",
  "schema_version": "1.0.0",
  "app_id": "test-app",
  "created_at": "2026-04-13T00:00:00.000Z",
  "updated_at": "2026-04-13T00:00:00.000Z",
  "tasks": [
    {
      "id": "T1",
      "title": "Bootstrap project",
      "authority_locus": "execution",
      "transformation": "Set up the project repository with initial structure.",
      "evidence_requirement": "Repository exists with README and license.",
      "review_predicate": "A reviewer can clone and build the project.",
      "status": "pending",
      "depends_on": [],
      "inputs": [
        { "name": "project_name", "description": "Name of the project", "source": "principal" }
      ],
      "expected_outputs": [
        { "name": "repo", "description": "Initialized repository", "format": "git" }
      ],
      "acceptance": {
        "criteria": ["Repository is cloneable", "Build succeeds"]
      }
    },
    {
      "id": "T2",
      "title": "Implement core feature",
      "authority_locus": "execution",
      "transformation": "Implement the primary feature of the system.",
      "evidence_requirement": "Feature is demonstrated with tests.",
      "review_predicate": "Tests pass and feature meets acceptance criteria.",
      "status": "claimed",
      "depends_on": ["T1"],
      "claim": {
        "claimant": "alice",
        "claimed_at": "2026-04-13T10:00:00.000Z",
        "expires_at": "2026-04-14T10:00:00.000Z"
      }
    },
    {
      "id": "T3",
      "title": "Deploy to staging",
      "authority_locus": "execution",
      "transformation": "Deploy the system to a staging environment.",
      "evidence_requirement": "Staging URL is accessible and health check passes.",
      "review_predicate": "Health check passes and smoke tests succeed.",
      "status": "completed",
      "depends_on": ["T2"],
      "result": {
        "artifact_reference": "https://staging.example.com",
        "completed_at": "2026-04-13T14:00:00.000Z",
        "completed_by": "alice"
      }
    },
    {
      "id": "T4",
      "title": "Fix critical bug",
      "authority_locus": "execution",
      "transformation": "Fix the critical bug reported in production.",
      "evidence_requirement": "Bug is reproduced, fixed, and verified.",
      "review_predicate": "Original reproduction case now passes.",
      "status": "blocked",
      "depends_on": [],
      "block": {
        "reason": "Waiting for reproduction steps from support team",
        "unblock_condition": "Support provides minimal reproduction case"
      }
    },
    {
      "id": "T5",
      "title": "Refactor legacy module",
      "authority_locus": "execution",
      "transformation": "Refactor the legacy module to meet current standards.",
      "evidence_requirement": "Refactored module passes all existing tests.",
      "review_predicate": "No regressions and code review approved.",
      "status": "rejected",
      "depends_on": ["T1"],
      "review": {
        "reviewer": "bob",
        "outcome": "reject",
        "reason": "Missing test coverage for edge cases",
        "reviewed_at": "2026-04-13T16:00:00.000Z",
        "next_action": "Add tests for null input handling and retry"
      }
    }
  ],
  "edges": [
    { "from": "T1", "to": "T2", "type": "blocks" },
    { "from": "T2", "to": "T3", "type": "blocks" }
  ]
}
